{
  "additional_details": "SAP has issued an update to correct this vulnerability. More details can be found at: https://www.sap.com/documents/2022/02/fa865ea4-167e-0010-bca6-c68f7e60039b.html",
  "advisory_date": "2022-11-03",
  "affected_products": [
    "3D Visual Enterprise Viewer"
  ],
  "affected_vendors": [
    "SAP"
  ],
  "credit": "Mat Powell of Trend Micro Zero Day Initiative",
  "cve": "CVE-2022-41198",
  "cve_url": "https://www.cve.org/CVERecord?id=CVE-2022-41198",
  "cvss": 5.3,
  "cvss_vector": "AV:L/AC:L/PR:N/UI:R/S:U/C:L/I:L/A:L",
  "disclosure_timeline": [
    "2022-06-30 - Vulnerability reported to vendor",
    "2022-11-03 - Coordinated public release of advisory"
  ],
  "kind": "published",
  "search_text": "published ZDI-22-1509 ZDI-CAN-17756 SAP 3D Visual Enterprise Viewer SKP File Parsing Use-After-Free Remote Code Execution Vulnerability 2022-11-03 CVE-2022-41198 https://www.cve.org/CVERecord?id=CVE-2022-41198 5.3 AV:L/AC:L/PR:N/UI:R/S:U/C:L/I:L/A:L ['SAP'] ['3D Visual Enterprise Viewer'] This vulnerability allows remote attackers to execute arbitrary code on affected installations of SAP 3D Visual Enterprise Viewer. User interaction is required to exploit this vulnerability in that the target must visit a malicious page or open a malicious file. The specific flaw exists within the parsing of SKP files. The issue results from the lack of validating the existence of an object prior to performing operations on the object. An attacker can leverage this vulnerability to execute code in the context of the current process. SAP has issued an update to correct this vulnerability. More details can be found at: https://www.sap.com/documents/2022/02/fa865ea4-167e-0010-bca6-c68f7e60039b.html ['2022-06-30 - Vulnerability reported to vendor', '2022-11-03 - Coordinated public release of advisory'] Mat Powell of Trend Micro Zero Day Initiative https://www.zerodayinitiative.com/advisories/ZDI-22-1509/",
  "source_url": "https://www.zerodayinitiative.com/advisories/ZDI-22-1509/",
  "title": "SAP 3D Visual Enterprise Viewer SKP File Parsing Use-After-Free Remote Code Execution Vulnerability",
  "updated_date": null,
  "vulnerability_details": "This vulnerability allows remote attackers to execute arbitrary code on affected installations of SAP 3D Visual Enterprise Viewer. User interaction is required to exploit this vulnerability in that the target must visit a malicious page or open a malicious file. The specific flaw exists within the parsing of SKP files. The issue results from the lack of validating the existence of an object prior to performing operations on the object. An attacker can leverage this vulnerability to execute code in the context of the current process.",
  "zdi_can": "ZDI-CAN-17756",
  "zdi_id": "ZDI-22-1509"
}
