{
  "additional_details": "Trend Micro has issued an update to correct this vulnerability. More details can be found at: https://helpcenter.trendmicro.com/en-us/article/TMKA-09909",
  "advisory_date": "2020-09-28",
  "affected_products": [
    "Maximum Security"
  ],
  "affected_vendors": [
    "Trend Micro"
  ],
  "credit": "Abdelhamid Naceri",
  "cve": "CVE-2020-25775",
  "cve_url": "https://www.cve.org/CVERecord?id=CVE-2020-25775",
  "cvss": 5.3,
  "cvss_vector": "AV:L/AC:H/PR:L/UI:N/S:U/C:N/I:L/A:H",
  "disclosure_timeline": [
    "2020-05-20 - Vulnerability reported to vendor",
    "2020-09-28 - Coordinated public release of advisory"
  ],
  "kind": "published",
  "search_text": "published ZDI-20-1227 ZDI-CAN-10819 Trend Micro Maximum Security Race Condition Arbitrary File Deletion Vulnerability 2020-09-28 CVE-2020-25775 https://www.cve.org/CVERecord?id=CVE-2020-25775 5.3 AV:L/AC:H/PR:L/UI:N/S:U/C:N/I:L/A:H ['Trend Micro'] ['Maximum Security'] This vulnerability allows local attackers to delete arbitrary files on affected installations of Trend Micro Maximum Security. An attacker must first obtain the ability to execute low-privileged code on the target system in order to exploit this vulnerability. The specific flaw exists within the implementation of the Secure Erase feature. The issue results from the lack of proper validation of a user-supplied link prior to using it in file operations. An attacker can leverage this vulnerability to delete files in the context of SYSTEM. Trend Micro has issued an update to correct this vulnerability. More details can be found at: https://helpcenter.trendmicro.com/en-us/article/TMKA-09909 ['2020-05-20 - Vulnerability reported to vendor', '2020-09-28 - Coordinated public release of advisory'] Abdelhamid Naceri https://www.zerodayinitiative.com/advisories/ZDI-20-1227/",
  "source_url": "https://www.zerodayinitiative.com/advisories/ZDI-20-1227/",
  "title": "Trend Micro Maximum Security Race Condition Arbitrary File Deletion Vulnerability",
  "updated_date": null,
  "vulnerability_details": "This vulnerability allows local attackers to delete arbitrary files on affected installations of Trend Micro Maximum Security. An attacker must first obtain the ability to execute low-privileged code on the target system in order to exploit this vulnerability. The specific flaw exists within the implementation of the Secure Erase feature. The issue results from the lack of proper validation of a user-supplied link prior to using it in file operations. An attacker can leverage this vulnerability to delete files in the context of SYSTEM.",
  "zdi_can": "ZDI-CAN-10819",
  "zdi_id": "ZDI-20-1227"
}
