{
  "additional_details": "NVIDIA has issued an update to correct this vulnerability. More details can be found at: https://nvidia.custhelp.com/app/answers/detail/a_id/5869",
  "advisory_date": "2026-08-13",
  "affected_products": [
    "Transformers4Rec"
  ],
  "affected_vendors": [
    "NVIDIA"
  ],
  "credit": "Legoclones",
  "cve": "CVE-2026-24232",
  "cve_url": "https://www.cve.org/CVERecord?id=CVE-2026-24232",
  "cvss": 7.8,
  "cvss_vector": "AV:L/AC:L/PR:N/UI:R/S:U/C:H/I:H/A:H",
  "disclosure_timeline": [
    "2025-12-31 - Vulnerability reported to vendor",
    "2026-08-13 - Coordinated public release of advisory",
    "2026-08-13 - Advisory Updated"
  ],
  "kind": "published",
  "search_text": "published ZDI-26-564 ZDI-CAN-28536 NVIDIA Transformers4Rec load_model_trainer_states_from_checkpoint Deserialization of Untrusted Data Remote Code Execution Vulnerability 2026-08-13 CVE-2026-24232 https://www.cve.org/CVERecord?id=CVE-2026-24232 7.8 AV:L/AC:L/PR:N/UI:R/S:U/C:H/I:H/A:H ['NVIDIA'] ['Transformers4Rec'] This vulnerability allows remote attackers to execute arbitrary code on affected installations of NVIDIA Transformers4Rec. User interaction is required to exploit this vulnerability in that the target must visit a malicious page or open a malicious file. The specific flaw exists within the load_model_trainer_states_from_checkpoint function. The issue results from the lack of proper validation of user-supplied data, which can result in deserialization of untrusted data. An attacker can leverage this vulnerability to execute code in the context of the current process. NVIDIA has issued an update to correct this vulnerability. More details can be found at: https://nvidia.custhelp.com/app/answers/detail/a_id/5869 ['2025-12-31 - Vulnerability reported to vendor', '2026-08-13 - Coordinated public release of advisory', '2026-08-13 - Advisory Updated'] Legoclones https://www.zerodayinitiative.com/advisories/ZDI-26-564/",
  "source_url": "https://www.zerodayinitiative.com/advisories/ZDI-26-564/",
  "title": "NVIDIA Transformers4Rec load_model_trainer_states_from_checkpoint Deserialization of Untrusted Data Remote Code Execution Vulnerability",
  "updated_date": "2026-08-13",
  "vulnerability_details": "This vulnerability allows remote attackers to execute arbitrary code on affected installations of NVIDIA Transformers4Rec. User interaction is required to exploit this vulnerability in that the target must visit a malicious page or open a malicious file. The specific flaw exists within the load_model_trainer_states_from_checkpoint function. The issue results from the lack of proper validation of user-supplied data, which can result in deserialization of untrusted data. An attacker can leverage this vulnerability to execute code in the context of the current process.",
  "zdi_can": "ZDI-CAN-28536",
  "zdi_id": "ZDI-26-564"
}
