{
  "additional_details": "08/01/23 \u2013 ZDI reported the vulnerability to the vendor 08/01/23 \u2013 The vendor acknowledged the receipt of the report 11/16/23 \u2013 ZDI asked for updates 11/16/23 \u2013The vendor communicated that the case was not fixed 12/05/23 \u2013 ZDI asked for updates 12/06/23 \u2013The vendor communicated that the case was not fixed 02/28/24 \u2013 ZDI notified the vendor of the intention to publish the case as 0-day advisory on 03/04/24 -- Mitigation: Fixed in version 12.6.1204.217",
  "advisory_date": "2024-03-05",
  "affected_products": [
    "Cobalt"
  ],
  "affected_vendors": [
    "Ashlar-Vellum"
  ],
  "credit": "Anonymous",
  "cve": null,
  "cve_url": null,
  "cvss": 7.8,
  "cvss_vector": "AV:L/AC:L/PR:N/UI:R/S:U/C:H/I:H/A:H",
  "disclosure_timeline": [
    "2023-08-01 - Vulnerability reported to vendor",
    "2024-03-05 - Coordinated public release of advisory",
    "2026-06-18 - Advisory Updated"
  ],
  "kind": "published",
  "search_text": "published ZDI-24-243 ZDI-CAN-21523 (0Day) Ashlar-Vellum Cobalt STP File Parsing Type Confusion Remote Code Execution Vulnerability 2024-03-05 7.8 AV:L/AC:L/PR:N/UI:R/S:U/C:H/I:H/A:H ['Ashlar-Vellum'] ['Cobalt'] This vulnerability allows remote attackers to execute arbitrary code on affected installations of Ashlar-Vellum Cobalt. User interaction is required to exploit this vulnerability in that the target must visit a malicious page or open a malicious file. The specific flaw exists within the parsing of STP files. The issue results from the lack of proper validation of user-supplied data, which can result in a type confusion condition. An attacker can leverage this vulnerability to execute code in the context of the current process. 08/01/23 \u2013 ZDI reported the vulnerability to the vendor 08/01/23 \u2013 The vendor acknowledged the receipt of the report 11/16/23 \u2013 ZDI asked for updates 11/16/23 \u2013The vendor communicated that the case was not fixed 12/05/23 \u2013 ZDI asked for updates 12/06/23 \u2013The vendor communicated that the case was not fixed 02/28/24 \u2013 ZDI notified the vendor of the intention to publish the case as 0-day advisory on 03/04/24 -- Mitigation: Fixed in version 12.6.1204.217 ['2023-08-01 - Vulnerability reported to vendor', '2024-03-05 - Coordinated public release of advisory', '2026-06-18 - Advisory Updated'] Anonymous https://www.zerodayinitiative.com/advisories/ZDI-24-243/",
  "source_url": "https://www.zerodayinitiative.com/advisories/ZDI-24-243/",
  "title": "(0Day) Ashlar-Vellum Cobalt STP File Parsing Type Confusion Remote Code Execution Vulnerability",
  "updated_date": "2026-06-18",
  "vulnerability_details": "This vulnerability allows remote attackers to execute arbitrary code on affected installations of Ashlar-Vellum Cobalt. User interaction is required to exploit this vulnerability in that the target must visit a malicious page or open a malicious file. The specific flaw exists within the parsing of STP files. The issue results from the lack of proper validation of user-supplied data, which can result in a type confusion condition. An attacker can leverage this vulnerability to execute code in the context of the current process.",
  "zdi_can": "ZDI-CAN-21523",
  "zdi_id": "ZDI-24-243"
}
