{
  "additional_details": "This vulnerability is being disclosed publicly without a patch in accordance with the ZDI 120 day deadline. 11/06/18 \u2013 ZDI sent the vulnerability reports to the vendor 11/28/18 \u2013 The vendor replied with tracking number 01/09/19 \u2013 ZDI requested an update (for these and other related reports) 01/30/19 - The vendor PSIRT replied they were working with the engineering team to get an updated schedule 02/27/19 \u2013 ZDI asked the vendor again for any ETA for updates for this product 03/04/19 \u2013 ZDI notified the vendor if these are not patched that the reports will be published as 0-day on 03/04 -- Mitigation: Given the nature of the vulnerability, the only salient mitigation strategy is to restrict interaction with the service to trusted machines. Only the clients and servers that have a legitimate procedural relationship with the service should be permitted to communicate with it. This could be accomplished in a number of ways, most notably with firewall rules/whitelisting.",
  "advisory_date": "2019-03-12",
  "affected_products": [
    "Intelligent Management Center"
  ],
  "affected_vendors": [
    "Hewlett Packard Enterprise"
  ],
  "credit": "Matthias Kaiser and Steven Seeley of Incite Team (Source Incite)",
  "cve": "CVE-2019-11964",
  "cve_url": "https://www.cve.org/CVERecord?id=CVE-2019-11964",
  "cvss": 8.8,
  "cvss_vector": "AV:N/AC:L/PR:L/UI:N/S:U/C:H/I:H/A:H",
  "disclosure_timeline": [
    "2018-11-07 - Vulnerability reported to vendor",
    "2019-03-12 - Coordinated public release of advisory",
    "2021-03-02 - Advisory Updated"
  ],
  "kind": "published",
  "search_text": "published ZDI-19-267 ZDI-CAN-6853 (0Day) Hewlett Packard Enterprise Intelligent Management Center iccSelectDeviceSeries Expression Language Injection Remote Code Execution Vulnerability 2019-03-12 CVE-2019-11964 https://www.cve.org/CVERecord?id=CVE-2019-11964 8.8 AV:N/AC:L/PR:L/UI:N/S:U/C:H/I:H/A:H ['Hewlett Packard Enterprise'] ['Intelligent Management Center'] This vulnerability allows remote attackers to execute arbitrary code on vulnerable installations of Hewlett Packard Enterprise Intelligent Management Center. Although authentication is required to exploit this vulnerability, the existing authentication mechanism can be bypassed. The specific flaw exists within the handling of the beanName parameter provided to the iccSelectDeviceSeries.xhtml endpoint. When parsing the beanName parameter, the process does not properly validate a user-supplied string before using it to render a page. An attacker can leverage this vulnerability to execute code in the context of SYSTEM. This vulnerability is being disclosed publicly without a patch in accordance with the ZDI 120 day deadline. 11/06/18 \u2013 ZDI sent the vulnerability reports to the vendor 11/28/18 \u2013 The vendor replied with tracking number 01/09/19 \u2013 ZDI requested an update (for these and other related reports) 01/30/19 - The vendor PSIRT replied they were working with the engineering team to get an updated schedule 02/27/19 \u2013 ZDI asked the vendor again for any ETA for updates for this product 03/04/19 \u2013 ZDI notified the vendor if these are not patched that the reports will be published as 0-day on 03/04 -- Mitigation: Given the nature of the vulnerability, the only salient mitigation strategy is to restrict interaction with the service to trusted machines. Only the clients and servers that have a legitimate procedural relationship with the service should be permitted to communicate with it. This could be accomplished in a number of ways, most notably with firewall rules/whitelisting. ['2018-11-07 - Vulnerability reported to vendor', '2019-03-12 - Coordinated public release of advisory', '2021-03-02 - Advisory Updated'] Matthias Kaiser and Steven Seeley of Incite Team (Source Incite) https://www.zerodayinitiative.com/advisories/ZDI-19-267/",
  "source_url": "https://www.zerodayinitiative.com/advisories/ZDI-19-267/",
  "title": "(0Day) Hewlett Packard Enterprise Intelligent Management Center iccSelectDeviceSeries Expression Language Injection Remote Code Execution Vulnerability",
  "updated_date": "2021-03-02",
  "vulnerability_details": "This vulnerability allows remote attackers to execute arbitrary code on vulnerable installations of Hewlett Packard Enterprise Intelligent Management Center. Although authentication is required to exploit this vulnerability, the existing authentication mechanism can be bypassed. The specific flaw exists within the handling of the beanName parameter provided to the iccSelectDeviceSeries.xhtml endpoint. When parsing the beanName parameter, the process does not properly validate a user-supplied string before using it to render a page. An attacker can leverage this vulnerability to execute code in the context of SYSTEM.",
  "zdi_can": "ZDI-CAN-6853",
  "zdi_id": "ZDI-19-267"
}
