{
  "additional_details": "ttps://www.cisa.gov/news-events/ics-advisories/icsa-25-219-01",
  "advisory_date": "2025-08-13",
  "affected_products": [
    "DIAView"
  ],
  "affected_vendors": [
    "Delta Electronics"
  ],
  "credit": "hir0ot",
  "cve": "CVE-2025-53417",
  "cve_url": "https://www.cve.org/CVERecord?id=CVE-2025-53417",
  "cvss": 9.8,
  "cvss_vector": "AV:N/AC:L/PR:N/UI:N/S:U/C:H/I:H/A:H",
  "disclosure_timeline": [
    "2025-03-05 - Vulnerability reported to vendor",
    "2025-08-13 - Coordinated public release of advisory",
    "2025-08-13 - Advisory Updated"
  ],
  "kind": "published",
  "search_text": "published ZDI-25-832 ZDI-CAN-26478 Delta Electronics DIAView Directory Traversal Remote Code Execution Vulnerability 2025-08-13 CVE-2025-53417 https://www.cve.org/CVERecord?id=CVE-2025-53417 9.8 AV:N/AC:L/PR:N/UI:N/S:U/C:H/I:H/A:H ['Delta Electronics'] ['DIAView'] This vulnerability allows remote attackers to execute arbitrary code on affected installations of Delta Electronics DIAView. Authentication is not required to exploit this vulnerability. The specific flaw exists within the web service, which listens on TCP port 80 by default. The issue results from the lack of proper validation of a user-supplied path prior to using it in file operations. An attacker can leverage this vulnerability to execute code in the context of the service account. ttps://www.cisa.gov/news-events/ics-advisories/icsa-25-219-01 ['2025-03-05 - Vulnerability reported to vendor', '2025-08-13 - Coordinated public release of advisory', '2025-08-13 - Advisory Updated'] hir0ot https://www.zerodayinitiative.com/advisories/ZDI-25-832/",
  "source_url": "https://www.zerodayinitiative.com/advisories/ZDI-25-832/",
  "title": "Delta Electronics DIAView Directory Traversal Remote Code Execution Vulnerability",
  "updated_date": "2025-08-13",
  "vulnerability_details": "This vulnerability allows remote attackers to execute arbitrary code on affected installations of Delta Electronics DIAView. Authentication is not required to exploit this vulnerability. The specific flaw exists within the web service, which listens on TCP port 80 by default. The issue results from the lack of proper validation of a user-supplied path prior to using it in file operations. An attacker can leverage this vulnerability to execute code in the context of the service account.",
  "zdi_can": "ZDI-CAN-26478",
  "zdi_id": "ZDI-25-832"
}
