{
  "additional_details": "Omron has issued an update to correct this vulnerability. More details can be found at: https://www.cisa.gov/uscert/ics/advisories/icsa-22-088-02",
  "advisory_date": "2022-04-05",
  "affected_products": [
    "CX-One"
  ],
  "affected_vendors": [
    "Omron"
  ],
  "credit": "xina1i",
  "cve": "CVE-2022-26419",
  "cve_url": "https://www.cve.org/CVERecord?id=CVE-2022-26419",
  "cvss": 7.8,
  "cvss_vector": "AV:L/AC:L/PR:N/UI:R/S:U/C:H/I:H/A:H",
  "disclosure_timeline": [
    "2021-10-06 - Vulnerability reported to vendor",
    "2022-04-05 - Coordinated public release of advisory"
  ],
  "kind": "published",
  "search_text": "published ZDI-22-575 ZDI-CAN-14674 Omron CX-One CX-Position NCI File Parsing Stack-based Buffer Overflow Remote Code Execution Vulnerability 2022-04-05 CVE-2022-26419 https://www.cve.org/CVERecord?id=CVE-2022-26419 7.8 AV:L/AC:L/PR:N/UI:R/S:U/C:H/I:H/A:H ['Omron'] ['CX-One'] This vulnerability allows remote attackers to execute arbitrary code on affected installations of Omron CX-One. User interaction is required to exploit this vulnerability in that the target must visit a malicious page or open a malicious file. The specific flaw exists within the parsing of NCI files in the CX-Position module. The issue results from the lack of proper validation of the length of user-supplied data prior to copying it to a fixed-length stack-based buffer. An attacker can leverage this vulnerability to execute code in the context of the current process. Omron has issued an update to correct this vulnerability. More details can be found at: https://www.cisa.gov/uscert/ics/advisories/icsa-22-088-02 ['2021-10-06 - Vulnerability reported to vendor', '2022-04-05 - Coordinated public release of advisory'] xina1i https://www.zerodayinitiative.com/advisories/ZDI-22-575/",
  "source_url": "https://www.zerodayinitiative.com/advisories/ZDI-22-575/",
  "title": "Omron CX-One CX-Position NCI File Parsing Stack-based Buffer Overflow Remote Code Execution Vulnerability",
  "updated_date": null,
  "vulnerability_details": "This vulnerability allows remote attackers to execute arbitrary code on affected installations of Omron CX-One. User interaction is required to exploit this vulnerability in that the target must visit a malicious page or open a malicious file. The specific flaw exists within the parsing of NCI files in the CX-Position module. The issue results from the lack of proper validation of the length of user-supplied data prior to copying it to a fixed-length stack-based buffer. An attacker can leverage this vulnerability to execute code in the context of the current process.",
  "zdi_can": "ZDI-CAN-14674",
  "zdi_id": "ZDI-22-575"
}
