{
  "additional_details": "X.Org has issued an update to correct this vulnerability. More details can be found at: https://gitlab.freedesktop.org/xorg/lib/libxfont/-/commit/dff957a5158da038a282a59a31fe736702732939",
  "advisory_date": "2026-07-15",
  "affected_products": [
    "Server"
  ],
  "affected_vendors": [
    "X.Org"
  ],
  "credit": "Anonymous",
  "cve": "CVE-2026-56003",
  "cve_url": "https://www.cve.org/CVERecord?id=CVE-2026-56003",
  "cvss": 7.8,
  "cvss_vector": "AV:L/AC:L/PR:L/UI:N/S:U/C:H/I:H/A:H",
  "disclosure_timeline": [
    "2026-05-29 - Vulnerability reported to vendor",
    "2026-07-15 - Coordinated public release of advisory",
    "2026-07-15 - Advisory Updated"
  ],
  "kind": "published",
  "search_text": "published ZDI-26-408 ZDI-CAN-30560 X.Org Server ComputeScaledProperties Heap-based Buffer Overflow Privilege Escalation Vulnerability 2026-07-15 CVE-2026-56003 https://www.cve.org/CVERecord?id=CVE-2026-56003 7.8 AV:L/AC:L/PR:L/UI:N/S:U/C:H/I:H/A:H ['X.Org'] ['Server'] This vulnerability allows local attackers to escalate privileges on affected installations of X.Org Server. An attacker must first obtain the ability to execute low-privileged code on the target system in order to exploit this vulnerability. The specific flaw exists within the ComputeScaledProperties function. The issue results from the lack of proper validation of the length of user-supplied data prior to copying it to a fixed-length, heap-based buffer. An attacker can leverage this vulnerability to escalate privileges and execute arbitrary code in the context of root. X.Org has issued an update to correct this vulnerability. More details can be found at: https://gitlab.freedesktop.org/xorg/lib/libxfont/-/commit/dff957a5158da038a282a59a31fe736702732939 ['2026-05-29 - Vulnerability reported to vendor', '2026-07-15 - Coordinated public release of advisory', '2026-07-15 - Advisory Updated'] Anonymous https://www.zerodayinitiative.com/advisories/ZDI-26-408/",
  "source_url": "https://www.zerodayinitiative.com/advisories/ZDI-26-408/",
  "title": "X.Org Server ComputeScaledProperties Heap-based Buffer Overflow Privilege Escalation Vulnerability",
  "updated_date": "2026-07-15",
  "vulnerability_details": "This vulnerability allows local attackers to escalate privileges on affected installations of X.Org Server. An attacker must first obtain the ability to execute low-privileged code on the target system in order to exploit this vulnerability. The specific flaw exists within the ComputeScaledProperties function. The issue results from the lack of proper validation of the length of user-supplied data prior to copying it to a fixed-length, heap-based buffer. An attacker can leverage this vulnerability to escalate privileges and execute arbitrary code in the context of root.",
  "zdi_can": "ZDI-CAN-30560",
  "zdi_id": "ZDI-26-408"
}
