{
  "additional_details": "GE has issued an update to correct this vulnerability. More details can be found at: http://ics-cert.us-cert.gov/advisories/ICSA-14-023-01",
  "advisory_date": "2014-02-13",
  "affected_products": [
    "Proficy CIMPLICITY"
  ],
  "affected_vendors": [
    "GE"
  ],
  "credit": "ZombiE and amisto0x07",
  "cve": "CVE-2014-0751",
  "cve_url": "https://www.cve.org/CVERecord?id=CVE-2014-0751",
  "cvss": 6.8,
  "cvss_vector": null,
  "disclosure_timeline": [
    "2013-02-22 - Vulnerability reported to vendor",
    "2014-02-13 - Coordinated public release of advisory"
  ],
  "kind": "published",
  "search_text": "published ZDI-14-016 ZDI-CAN-1623 GE Proficy CIMPLICITY CimWebServer File Upload Remote Code Execution Vulnerability 2014-02-13 CVE-2014-0751 https://www.cve.org/CVERecord?id=CVE-2014-0751 6.8 ['GE'] ['Proficy CIMPLICITY'] This vulnerability allows remote attackers to execute arbitrary code on vulnerable installations of GE Proficy CIMPLICITY. Authentication is not required to exploit this vulnerability. The specific flaw exists within the CimWebServer component. This component performs insufficient parameter validation on the szScreen field. Successful exploitation will allow an attacker to upload and execute an arbitrary file on the target server. GE has issued an update to correct this vulnerability. More details can be found at: http://ics-cert.us-cert.gov/advisories/ICSA-14-023-01 ['2013-02-22 - Vulnerability reported to vendor', '2014-02-13 - Coordinated public release of advisory'] ZombiE and amisto0x07 https://www.zerodayinitiative.com/advisories/ZDI-14-016/",
  "source_url": "https://www.zerodayinitiative.com/advisories/ZDI-14-016/",
  "title": "GE Proficy CIMPLICITY CimWebServer File Upload Remote Code Execution Vulnerability",
  "updated_date": null,
  "vulnerability_details": "This vulnerability allows remote attackers to execute arbitrary code on vulnerable installations of GE Proficy CIMPLICITY. Authentication is not required to exploit this vulnerability. The specific flaw exists within the CimWebServer component. This component performs insufficient parameter validation on the szScreen field. Successful exploitation will allow an attacker to upload and execute an arbitrary file on the target server.",
  "zdi_can": "ZDI-CAN-1623",
  "zdi_id": "ZDI-14-016"
}
