{
  "additional_details": "Foxit has issued an update to correct this vulnerability. More details can be found at: https://www.foxitsoftware.com/support/security-bulletins.php",
  "advisory_date": "2020-04-16",
  "affected_products": [
    "PhantomPDF"
  ],
  "affected_vendors": [
    "Foxit"
  ],
  "credit": "Anonymous",
  "cve": "CVE-2020-10892",
  "cve_url": "https://www.cve.org/CVERecord?id=CVE-2020-10892",
  "cvss": 7.8,
  "cvss_vector": "AV:L/AC:L/PR:N/UI:R/S:U/C:H/I:H/A:H",
  "disclosure_timeline": [
    "2019-12-19 - Vulnerability reported to vendor",
    "2020-04-16 - Coordinated public release of advisory"
  ],
  "kind": "published",
  "search_text": "published ZDI-20-513 ZDI-CAN-9830 Foxit PhantomPDF CombineFiles Arbitrary File Write Remote Code Execution Vulnerability 2020-04-16 CVE-2020-10892 https://www.cve.org/CVERecord?id=CVE-2020-10892 7.8 AV:L/AC:L/PR:N/UI:R/S:U/C:H/I:H/A:H ['Foxit'] ['PhantomPDF'] This vulnerability allows remote attackers to execute arbitrary code on affected installations of Foxit PhantomPDF. User interaction is required to exploit this vulnerability in that the target must visit a malicious page or open a malicious file. The specific flaw exists within the communication API. The issue lies in the handling of the CombineFiles command, which allows an arbitrary file write with attacker controlled data. An attacker can leverage this vulnerability to execute code in the context of the current process. Foxit has issued an update to correct this vulnerability. More details can be found at: https://www.foxitsoftware.com/support/security-bulletins.php ['2019-12-19 - Vulnerability reported to vendor', '2020-04-16 - Coordinated public release of advisory'] Anonymous https://www.zerodayinitiative.com/advisories/ZDI-20-513/",
  "source_url": "https://www.zerodayinitiative.com/advisories/ZDI-20-513/",
  "title": "Foxit PhantomPDF CombineFiles Arbitrary File Write Remote Code Execution Vulnerability",
  "updated_date": null,
  "vulnerability_details": "This vulnerability allows remote attackers to execute arbitrary code on affected installations of Foxit PhantomPDF. User interaction is required to exploit this vulnerability in that the target must visit a malicious page or open a malicious file. The specific flaw exists within the communication API. The issue lies in the handling of the CombineFiles command, which allows an arbitrary file write with attacker controlled data. An attacker can leverage this vulnerability to execute code in the context of the current process.",
  "zdi_can": "ZDI-CAN-9830",
  "zdi_id": "ZDI-20-513"
}
