{
  "additional_details": "Microsoft has issued an update to correct this vulnerability. More details can be found at: http://technet.microsoft.com/en-us/security/bulletin/ms12-063",
  "advisory_date": "2013-02-01",
  "affected_products": [
    "Internet Explorer 9"
  ],
  "affected_vendors": [
    "Microsoft"
  ],
  "credit": "Stephen Fewer of Harmony Security (www.harmonysecurity.com)",
  "cve": "CVE-2012-2548",
  "cve_url": "https://www.cve.org/CVERecord?id=CVE-2012-2548",
  "cvss": 7.5,
  "cvss_vector": "AV:N/AC:L/Au:N/C:P/I:P/A:P",
  "disclosure_timeline": [
    "2012-11-09 - Vulnerability reported to vendor",
    "2013-02-01 - Coordinated public release of advisory"
  ],
  "kind": "published",
  "search_text": "published ZDI-13-007 ZDI-CAN-1550 Microsoft Internet Explorer Layout Remote Code Execution Vulnerability 2013-02-01 CVE-2012-2548 https://www.cve.org/CVERecord?id=CVE-2012-2548 7.5 AV:N/AC:L/Au:N/C:P/I:P/A:P ['Microsoft'] ['Internet Explorer 9'] This vulnerability allows remote attackers to execute arbitrary code on vulnerable installations of Microsoft Internet Explorer. User interaction is required to exploit this vulnerability in that the target must visit a malicious page or open a malicious file. The specific flaw exists within the way Internet Explorer handles CCaret objects. After the CCaret object has been freed there exists a race condition to reclaim the target objects heap buffer before a background thread issues a message to update the screen caret and reuse the stale pointer. An attacker can leverage this vulnerability to execute code under the context of the current process. Microsoft has issued an update to correct this vulnerability. More details can be found at: http://technet.microsoft.com/en-us/security/bulletin/ms12-063 ['2012-11-09 - Vulnerability reported to vendor', '2013-02-01 - Coordinated public release of advisory'] Stephen Fewer of Harmony Security (www.harmonysecurity.com) https://www.zerodayinitiative.com/advisories/ZDI-13-007/",
  "source_url": "https://www.zerodayinitiative.com/advisories/ZDI-13-007/",
  "title": "Microsoft Internet Explorer Layout Remote Code Execution Vulnerability",
  "updated_date": null,
  "vulnerability_details": "This vulnerability allows remote attackers to execute arbitrary code on vulnerable installations of Microsoft Internet Explorer. User interaction is required to exploit this vulnerability in that the target must visit a malicious page or open a malicious file. The specific flaw exists within the way Internet Explorer handles CCaret objects. After the CCaret object has been freed there exists a race condition to reclaim the target objects heap buffer before a background thread issues a message to update the screen caret and reuse the stale pointer. An attacker can leverage this vulnerability to execute code under the context of the current process.",
  "zdi_can": "ZDI-CAN-1550",
  "zdi_id": "ZDI-13-007"
}
