{
  "additional_details": "Rockwell Automation has issued an update to correct this vulnerability. More details can be found at: https://ics-cert.us-cert.gov/advisories/ICSA-14-294-01",
  "advisory_date": "2014-11-19",
  "affected_products": [
    "Connected Components Workbench"
  ],
  "affected_vendors": [
    "Rockwell Automation"
  ],
  "credit": "Andrea Micalizzi (rgod)",
  "cve": "CVE-2014-5424",
  "cve_url": "https://www.cve.org/CVERecord?id=CVE-2014-5424",
  "cvss": 7.5,
  "cvss_vector": "AV:N/AC:L/Au:N/C:P/I:P/A:P",
  "disclosure_timeline": [
    "2014-07-17 - Vulnerability reported to vendor",
    "2014-11-19 - Coordinated public release of advisory"
  ],
  "kind": "published",
  "search_text": "published ZDI-14-383 ZDI-CAN-2417 Rockwell Automation Connected Components Workbench RA.ViewElements.Grid.1 Arbitrary Write Remote Code Execution Vulnerability 2014-11-19 CVE-2014-5424 https://www.cve.org/CVERecord?id=CVE-2014-5424 7.5 AV:N/AC:L/Au:N/C:P/I:P/A:P ['Rockwell Automation'] ['Connected Components Workbench'] This vulnerability allows remote attackers to execute arbitrary code on vulnerable installations of Rockwell Automation Connected Components Workbench. User interaction is required to exploit this vulnerability in that the target must visit a malicious page or open a malicious file. The specific flaw exists within the RA.ViewElements.Grid.1 ActiveXControl method. By providing a malicious value to the LeftXOffset property, an attacker can write a four byte null value to an arbitrary location. An attacker could use this to execute arbitrary code in the context of the browser. Rockwell Automation has issued an update to correct this vulnerability. More details can be found at: https://ics-cert.us-cert.gov/advisories/ICSA-14-294-01 ['2014-07-17 - Vulnerability reported to vendor', '2014-11-19 - Coordinated public release of advisory'] Andrea Micalizzi (rgod) https://www.zerodayinitiative.com/advisories/ZDI-14-383/",
  "source_url": "https://www.zerodayinitiative.com/advisories/ZDI-14-383/",
  "title": "Rockwell Automation Connected Components Workbench RA.ViewElements.Grid.1 Arbitrary Write Remote Code Execution Vulnerability",
  "updated_date": null,
  "vulnerability_details": "This vulnerability allows remote attackers to execute arbitrary code on vulnerable installations of Rockwell Automation Connected Components Workbench. User interaction is required to exploit this vulnerability in that the target must visit a malicious page or open a malicious file. The specific flaw exists within the RA.ViewElements.Grid.1 ActiveXControl method. By providing a malicious value to the LeftXOffset property, an attacker can write a four byte null value to an arbitrary location. An attacker could use this to execute arbitrary code in the context of the browser.",
  "zdi_can": "ZDI-CAN-2417",
  "zdi_id": "ZDI-14-383"
}
