{
  "additional_details": "Fixed in version 6",
  "advisory_date": "2022-01-17",
  "affected_products": [
    "Archer C90"
  ],
  "affected_vendors": [
    "TP-Link"
  ],
  "credit": "Team FLASHBACK: Pedro Ribeiro (@pedrib1337 | pedrib@gmail.com) + Radek Domanski (@RabbitPro)",
  "cve": "CVE-2021-35003",
  "cve_url": "https://www.cve.org/CVERecord?id=CVE-2021-35003",
  "cvss": 9.8,
  "cvss_vector": "AV:N/AC:L/PR:N/UI:N/S:U/C:H/I:H/A:H",
  "disclosure_timeline": [
    "2021-09-16 - Vulnerability reported to vendor",
    "2022-01-17 - Coordinated public release of advisory"
  ],
  "kind": "published",
  "search_text": "published ZDI-22-080 ZDI-CAN-14655 TP-Link Archer C90 DNS Response Stack-based Buffer Overflow Remote Code Execution Vulnerability 2022-01-17 CVE-2021-35003 https://www.cve.org/CVERecord?id=CVE-2021-35003 9.8 AV:N/AC:L/PR:N/UI:N/S:U/C:H/I:H/A:H ['TP-Link'] ['Archer C90'] This vulnerability allows remote attackers to execute arbitrary code on affected installations of TP-Link Archer C90 routers. Authentication is not required to exploit this vulnerability. The specific flaw exists within the handling of DNS responses. A crafted DNS message can trigger an overflow of a fixed-length, stack-based buffer. An attacker can leverage this vulnerability to execute code in the context of root. Fixed in version 6 ['2021-09-16 - Vulnerability reported to vendor', '2022-01-17 - Coordinated public release of advisory'] Team FLASHBACK: Pedro Ribeiro (@pedrib1337 | pedrib@gmail.com) + Radek Domanski (@RabbitPro) https://www.zerodayinitiative.com/advisories/ZDI-22-080/",
  "source_url": "https://www.zerodayinitiative.com/advisories/ZDI-22-080/",
  "title": "TP-Link Archer C90 DNS Response Stack-based Buffer Overflow Remote Code Execution Vulnerability",
  "updated_date": null,
  "vulnerability_details": "This vulnerability allows remote attackers to execute arbitrary code on affected installations of TP-Link Archer C90 routers. Authentication is not required to exploit this vulnerability. The specific flaw exists within the handling of DNS responses. A crafted DNS message can trigger an overflow of a fixed-length, stack-based buffer. An attacker can leverage this vulnerability to execute code in the context of root.",
  "zdi_can": "ZDI-CAN-14655",
  "zdi_id": "ZDI-22-080"
}
