{
  "additional_details": "Foxit has issued an update to correct this vulnerability. More details can be found at: https://www.foxitsoftware.com/support/security-bulletins.html",
  "advisory_date": "2021-04-26",
  "affected_products": [
    "Studio Photo"
  ],
  "affected_vendors": [
    "Foxit"
  ],
  "credit": "Francis Provencher {PRL}",
  "cve": "CVE-2021-31433",
  "cve_url": "https://www.cve.org/CVERecord?id=CVE-2021-31433",
  "cvss": 7.8,
  "cvss_vector": "AV:L/AC:L/PR:N/UI:R/S:U/C:H/I:H/A:H",
  "disclosure_timeline": [
    "2020-11-18 - Vulnerability reported to vendor",
    "2021-04-26 - Coordinated public release of advisory"
  ],
  "kind": "published",
  "search_text": "published ZDI-21-476 ZDI-CAN-12333 Foxit Studio Photo ARW File Parsing Out-Of-Bounds Write Remote Code Execution Vulnerability 2021-04-26 CVE-2021-31433 https://www.cve.org/CVERecord?id=CVE-2021-31433 7.8 AV:L/AC:L/PR:N/UI:R/S:U/C:H/I:H/A:H ['Foxit'] ['Studio Photo'] This vulnerability allows remote attackers to execute arbitrary code on affected installations of Foxit Studio Photo. User interaction is required to exploit this vulnerability in that the target must visit a malicious page or open a malicious file. The specific flaw exists within the parsing of ARW files. The issue results from the lack of proper validation of user-supplied data, which can result in a write past the end of an allocated data structure. An attacker can leverage this vulnerability to execute code in the context of the current process. Foxit has issued an update to correct this vulnerability. More details can be found at: https://www.foxitsoftware.com/support/security-bulletins.html ['2020-11-18 - Vulnerability reported to vendor', '2021-04-26 - Coordinated public release of advisory'] Francis Provencher {PRL} https://www.zerodayinitiative.com/advisories/ZDI-21-476/",
  "source_url": "https://www.zerodayinitiative.com/advisories/ZDI-21-476/",
  "title": "Foxit Studio Photo ARW File Parsing Out-Of-Bounds Write Remote Code Execution Vulnerability",
  "updated_date": null,
  "vulnerability_details": "This vulnerability allows remote attackers to execute arbitrary code on affected installations of Foxit Studio Photo. User interaction is required to exploit this vulnerability in that the target must visit a malicious page or open a malicious file. The specific flaw exists within the parsing of ARW files. The issue results from the lack of proper validation of user-supplied data, which can result in a write past the end of an allocated data structure. An attacker can leverage this vulnerability to execute code in the context of the current process.",
  "zdi_can": "ZDI-CAN-12333",
  "zdi_id": "ZDI-21-476"
}
