{
  "additional_details": "Adobe has issued an update to correct this vulnerability. More details can be found at: https://helpx.adobe.com/security/products/illustrator/apsb22-26.html",
  "advisory_date": "2022-06-15",
  "affected_products": [
    "Illustrator"
  ],
  "affected_vendors": [
    "Adobe"
  ],
  "credit": "Mat Powell of Trend Micro Zero Day Initiative",
  "cve": "CVE-2022-30640",
  "cve_url": "https://www.cve.org/CVERecord?id=CVE-2022-30640",
  "cvss": 7.8,
  "cvss_vector": "AV:L/AC:L/PR:N/UI:R/S:U/C:H/I:H/A:H",
  "disclosure_timeline": [
    "2022-02-03 - Vulnerability reported to vendor",
    "2022-06-15 - Coordinated public release of advisory"
  ],
  "kind": "published",
  "search_text": "published ZDI-22-817 ZDI-CAN-16489 Adobe Illustrator Font Parsing Out-Of-Bounds Write Remote Code Execution Vulnerability 2022-06-15 CVE-2022-30640 https://www.cve.org/CVERecord?id=CVE-2022-30640 7.8 AV:L/AC:L/PR:N/UI:R/S:U/C:H/I:H/A:H ['Adobe'] ['Illustrator'] This vulnerability allows remote attackers to execute arbitrary code on affected installations of Adobe Illustrator. User interaction is required to exploit this vulnerability in that the target must visit a malicious page or open a malicious file. The specific flaw exists within the parsing of embedded fonts. Crafted data in a font can trigger a write past the end of an allocated buffer. An attacker can leverage this vulnerability to execute code in the context of the current process. Adobe has issued an update to correct this vulnerability. More details can be found at: https://helpx.adobe.com/security/products/illustrator/apsb22-26.html ['2022-02-03 - Vulnerability reported to vendor', '2022-06-15 - Coordinated public release of advisory'] Mat Powell of Trend Micro Zero Day Initiative https://www.zerodayinitiative.com/advisories/ZDI-22-817/",
  "source_url": "https://www.zerodayinitiative.com/advisories/ZDI-22-817/",
  "title": "Adobe Illustrator Font Parsing Out-Of-Bounds Write Remote Code Execution Vulnerability",
  "updated_date": null,
  "vulnerability_details": "This vulnerability allows remote attackers to execute arbitrary code on affected installations of Adobe Illustrator. User interaction is required to exploit this vulnerability in that the target must visit a malicious page or open a malicious file. The specific flaw exists within the parsing of embedded fonts. Crafted data in a font can trigger a write past the end of an allocated buffer. An attacker can leverage this vulnerability to execute code in the context of the current process.",
  "zdi_can": "ZDI-CAN-16489",
  "zdi_id": "ZDI-22-817"
}
