{
  "additional_details": "Adobe has issued an update to correct this vulnerability. More details can be found at: https://helpx.adobe.com/security/products/acrobat/apsb19-49.html",
  "advisory_date": "2019-10-15",
  "affected_products": [
    "Acrobat Pro DC"
  ],
  "affected_vendors": [
    "Adobe"
  ],
  "credit": "Mat Powell of Trend Micro Zero Day Initiative",
  "cve": "CVE-2019-8188",
  "cve_url": "https://www.cve.org/CVERecord?id=CVE-2019-8188",
  "cvss": 3.3,
  "cvss_vector": "AV:L/AC:L/PR:N/UI:R/S:U/C:L/I:N/A:N",
  "disclosure_timeline": [
    "2019-08-07 - Vulnerability reported to vendor",
    "2019-10-15 - Coordinated public release of advisory"
  ],
  "kind": "published",
  "search_text": "published ZDI-19-884 ZDI-CAN-9263 Adobe Acrobat Pro DC DWG File Parsing Use-After-Free Information Disclosure Vulnerability 2019-10-15 CVE-2019-8188 https://www.cve.org/CVERecord?id=CVE-2019-8188 3.3 AV:L/AC:L/PR:N/UI:R/S:U/C:L/I:N/A:N ['Adobe'] ['Acrobat Pro DC'] This vulnerability allows remote attackers to disclose sensitive information on affected installations of Adobe Acrobat Pro DC. User interaction is required to exploit this vulnerability in that the target must visit a malicious page or open a malicious file. The specific flaw exists within the parsing of DWG files. The issue results from the lack of validating the existence of an object prior to performing operations on the object. An attacker can leverage this in conjunction with other vulnerabilities to execute code in the context of the current process. Adobe has issued an update to correct this vulnerability. More details can be found at: https://helpx.adobe.com/security/products/acrobat/apsb19-49.html ['2019-08-07 - Vulnerability reported to vendor', '2019-10-15 - Coordinated public release of advisory'] Mat Powell of Trend Micro Zero Day Initiative https://www.zerodayinitiative.com/advisories/ZDI-19-884/",
  "source_url": "https://www.zerodayinitiative.com/advisories/ZDI-19-884/",
  "title": "Adobe Acrobat Pro DC DWG File Parsing Use-After-Free Information Disclosure Vulnerability",
  "updated_date": null,
  "vulnerability_details": "This vulnerability allows remote attackers to disclose sensitive information on affected installations of Adobe Acrobat Pro DC. User interaction is required to exploit this vulnerability in that the target must visit a malicious page or open a malicious file. The specific flaw exists within the parsing of DWG files. The issue results from the lack of validating the existence of an object prior to performing operations on the object. An attacker can leverage this in conjunction with other vulnerabilities to execute code in the context of the current process.",
  "zdi_can": "ZDI-CAN-9263",
  "zdi_id": "ZDI-19-884"
}
