{
  "additional_details": "Adobe has issued an update to correct this vulnerability. More details can be found at: https://helpx.adobe.com/security/products/flash-player/apsb19-46.html",
  "advisory_date": "2019-09-10",
  "affected_products": [
    "Flash"
  ],
  "affected_vendors": [
    "Adobe"
  ],
  "credit": "Eduardo Braun Prado",
  "cve": "CVE-2019-8069",
  "cve_url": "https://www.cve.org/CVERecord?id=CVE-2019-8069",
  "cvss": 8.8,
  "cvss_vector": "AV:N/AC:L/PR:N/UI:R/S:U/C:H/I:H/A:H",
  "disclosure_timeline": [
    "2019-07-09 - Vulnerability reported to vendor",
    "2019-09-10 - Coordinated public release of advisory"
  ],
  "kind": "published",
  "search_text": "published ZDI-19-817 ZDI-CAN-8853 Adobe Flash Player navigateToURL Same-Origin Policy Bypass Remote Code Execution Vulnerability 2019-09-10 CVE-2019-8069 https://www.cve.org/CVERecord?id=CVE-2019-8069 8.8 AV:N/AC:L/PR:N/UI:R/S:U/C:H/I:H/A:H ['Adobe'] ['Flash'] This vulnerability allows remote attackers to execute arbitrary code on affected installations of Adobe Flash Player. User interaction is required to exploit this vulnerability in that the target must visit a malicious page or open a malicious file. The specific flaw exists within the behavior of the navigateToURL function in ActionScript. By performing actions in ActionScript, an attacker can execute script in a privileged context in violation of the same-origin policy. An attacker can leverage this vulnerability to execute code in the context of the current user. Adobe has issued an update to correct this vulnerability. More details can be found at: https://helpx.adobe.com/security/products/flash-player/apsb19-46.html ['2019-07-09 - Vulnerability reported to vendor', '2019-09-10 - Coordinated public release of advisory'] Eduardo Braun Prado https://www.zerodayinitiative.com/advisories/ZDI-19-817/",
  "source_url": "https://www.zerodayinitiative.com/advisories/ZDI-19-817/",
  "title": "Adobe Flash Player navigateToURL Same-Origin Policy Bypass Remote Code Execution Vulnerability",
  "updated_date": null,
  "vulnerability_details": "This vulnerability allows remote attackers to execute arbitrary code on affected installations of Adobe Flash Player. User interaction is required to exploit this vulnerability in that the target must visit a malicious page or open a malicious file. The specific flaw exists within the behavior of the navigateToURL function in ActionScript. By performing actions in ActionScript, an attacker can execute script in a privileged context in violation of the same-origin policy. An attacker can leverage this vulnerability to execute code in the context of the current user.",
  "zdi_can": "ZDI-CAN-8853",
  "zdi_id": "ZDI-19-817"
}
