{
  "additional_details": "Fixed in IrfanView CADImage Plugin version 4.72",
  "advisory_date": "2025-07-08",
  "affected_products": [
    "IrfanView"
  ],
  "affected_vendors": [
    "IrfanView"
  ],
  "credit": "Andrea Micalizzi aka rgod (@rgod777)",
  "cve": "CVE-2025-7252",
  "cve_url": "https://www.cve.org/CVERecord?id=CVE-2025-7252",
  "cvss": 7.8,
  "cvss_vector": "AV:L/AC:L/PR:N/UI:R/S:U/C:H/I:H/A:H",
  "disclosure_timeline": [
    "2025-02-05 - Vulnerability reported to vendor",
    "2025-07-08 - Coordinated public release of advisory",
    "2025-07-08 - Advisory Updated"
  ],
  "kind": "published",
  "search_text": "published ZDI-25-484 ZDI-CAN-26109 IrfanView CADImage Plugin DWG File Parsing Out-Of-Bounds Read Remote Code Execution Vulnerability 2025-07-08 CVE-2025-7252 https://www.cve.org/CVERecord?id=CVE-2025-7252 7.8 AV:L/AC:L/PR:N/UI:R/S:U/C:H/I:H/A:H ['IrfanView'] ['IrfanView'] This vulnerability allows remote attackers to execute arbitrary code on affected installations of IrfanView CADImage Plugin. User interaction is required to exploit this vulnerability in that the target must visit a malicious page or open a malicious file. The specific flaw exists within the parsing of DWG files. The issue results from the lack of proper validation of user-supplied data, which can result in a read past the end of an allocated buffer. An attacker can leverage this vulnerability to execute code in the context of the current process. Fixed in IrfanView CADImage Plugin version 4.72 ['2025-02-05 - Vulnerability reported to vendor', '2025-07-08 - Coordinated public release of advisory', '2025-07-08 - Advisory Updated'] Andrea Micalizzi aka rgod (@rgod777) https://www.zerodayinitiative.com/advisories/ZDI-25-484/",
  "source_url": "https://www.zerodayinitiative.com/advisories/ZDI-25-484/",
  "title": "IrfanView CADImage Plugin DWG File Parsing Out-Of-Bounds Read Remote Code Execution Vulnerability",
  "updated_date": "2025-07-08",
  "vulnerability_details": "This vulnerability allows remote attackers to execute arbitrary code on affected installations of IrfanView CADImage Plugin. User interaction is required to exploit this vulnerability in that the target must visit a malicious page or open a malicious file. The specific flaw exists within the parsing of DWG files. The issue results from the lack of proper validation of user-supplied data, which can result in a read past the end of an allocated buffer. An attacker can leverage this vulnerability to execute code in the context of the current process.",
  "zdi_can": "ZDI-CAN-26109",
  "zdi_id": "ZDI-25-484"
}
