{
  "additional_details": "QNAP has issued an update to correct this vulnerability. More details can be found at: https://www.qnap.com/en/security-advisory/qsa-25-48",
  "advisory_date": "2026-03-16",
  "affected_products": [
    "TS-453E"
  ],
  "affected_vendors": [
    "QNAP"
  ],
  "credit": "Sina Kheirkhah (@SinSinology) of Summoning Team (@SummoningTeam)",
  "cve": "CVE-2025-59389",
  "cve_url": "https://www.cve.org/CVERecord?id=CVE-2025-59389",
  "cvss": 8.0,
  "cvss_vector": "AV:A/AC:L/PR:L/UI:N/S:U/C:H/I:H/A:H",
  "disclosure_timeline": [
    "2025-12-15 - Vulnerability reported to vendor",
    "2026-03-16 - Coordinated public release of advisory",
    "2026-03-16 - Advisory Updated"
  ],
  "kind": "published",
  "search_text": "published ZDI-26-202 ZDI-CAN-28475 (Pwn2Own) QNAP TS-453E Hyper Data Protector Plugin query_original_file_size SQL Injection Remote Code Execution Vulnerability 2026-03-16 CVE-2025-59389 https://www.cve.org/CVERecord?id=CVE-2025-59389 8.0 AV:A/AC:L/PR:L/UI:N/S:U/C:H/I:H/A:H ['QNAP'] ['TS-453E'] This vulnerability allows network-adjacent attackers to execute arbitrary code on affected installations of QNAP TS-453E. Although authentication is required to exploit this vulnerability, the existing authentication mechanism can be bypassed. The specific flaw exists within the query_original_file_size method. The issue results from the lack of proper validation of a user-supplied string before using it to construct SQL queries. An attacker can leverage this vulnerability to execute code in the context of root. QNAP has issued an update to correct this vulnerability. More details can be found at: https://www.qnap.com/en/security-advisory/qsa-25-48 ['2025-12-15 - Vulnerability reported to vendor', '2026-03-16 - Coordinated public release of advisory', '2026-03-16 - Advisory Updated'] Sina Kheirkhah (@SinSinology) of Summoning Team (@SummoningTeam) https://www.zerodayinitiative.com/advisories/ZDI-26-202/",
  "source_url": "https://www.zerodayinitiative.com/advisories/ZDI-26-202/",
  "title": "(Pwn2Own) QNAP TS-453E Hyper Data Protector Plugin query_original_file_size SQL Injection Remote Code Execution Vulnerability",
  "updated_date": "2026-03-16",
  "vulnerability_details": "This vulnerability allows network-adjacent attackers to execute arbitrary code on affected installations of QNAP TS-453E. Although authentication is required to exploit this vulnerability, the existing authentication mechanism can be bypassed. The specific flaw exists within the query_original_file_size method. The issue results from the lack of proper validation of a user-supplied string before using it to construct SQL queries. An attacker can leverage this vulnerability to execute code in the context of root.",
  "zdi_can": "ZDI-CAN-28475",
  "zdi_id": "ZDI-26-202"
}
