{
  "additional_details": "Adobe has issued an update to correct this vulnerability. More details can be found at: https://helpx.adobe.com/security/products/acrobat/apsb18-02.html",
  "advisory_date": "2018-02-24",
  "affected_products": [
    "Acrobat Pro DC"
  ],
  "affected_vendors": [
    "Adobe"
  ],
  "credit": "Ke Liu of Tencent's Xuanwu LAB",
  "cve": "CVE-2018-4889",
  "cve_url": "https://www.cve.org/CVERecord?id=CVE-2018-4889",
  "cvss": 2.6,
  "cvss_vector": "AV:N/AC:H/Au:N/C:P/I:N/A:N",
  "disclosure_timeline": [
    "2017-10-26 - Vulnerability reported to vendor",
    "2018-02-24 - Coordinated public release of advisory",
    "2018-02-24 - Advisory Updated"
  ],
  "kind": "published",
  "search_text": "published ZDI-18-191 ZDI-CAN-5222 Adobe Acrobat Pro DC ImageConversion XPS JPEG Parsing Out-Of-Bounds Read Information Disclosure Vulnerability 2018-02-24 CVE-2018-4889 https://www.cve.org/CVERecord?id=CVE-2018-4889 2.6 AV:N/AC:H/Au:N/C:P/I:N/A:N ['Adobe'] ['Acrobat Pro DC'] This vulnerability allows remote attackers to disclose sensitive information on vulnerable installations of Adobe Acrobat Pro DC. User interaction is required to exploit this vulnerability in that the target must visit a malicious page or open a malicious file. The specific flaw exists within the parsing of JPEG images embedded inside XPS files. The issue results from the lack of proper validation of user-supplied data, which can result in a read past the end of an allocated object. An attacker can leverage this in conjunction with other vulnerabilities to execute code in the context of the current process. Adobe has issued an update to correct this vulnerability. More details can be found at: https://helpx.adobe.com/security/products/acrobat/apsb18-02.html ['2017-10-26 - Vulnerability reported to vendor', '2018-02-24 - Coordinated public release of advisory', '2018-02-24 - Advisory Updated'] Ke Liu of Tencent's Xuanwu LAB https://www.zerodayinitiative.com/advisories/ZDI-18-191/",
  "source_url": "https://www.zerodayinitiative.com/advisories/ZDI-18-191/",
  "title": "Adobe Acrobat Pro DC ImageConversion XPS JPEG Parsing Out-Of-Bounds Read Information Disclosure Vulnerability",
  "updated_date": "2018-02-24",
  "vulnerability_details": "This vulnerability allows remote attackers to disclose sensitive information on vulnerable installations of Adobe Acrobat Pro DC. User interaction is required to exploit this vulnerability in that the target must visit a malicious page or open a malicious file. The specific flaw exists within the parsing of JPEG images embedded inside XPS files. The issue results from the lack of proper validation of user-supplied data, which can result in a read past the end of an allocated object. An attacker can leverage this in conjunction with other vulnerabilities to execute code in the context of the current process.",
  "zdi_can": "ZDI-CAN-5222",
  "zdi_id": "ZDI-18-191"
}
