{
  "additional_details": "fixed with the latest patch release VE Viewer 9.0 FP10",
  "advisory_date": "2021-01-12",
  "affected_products": [
    "3D Visual Enterprise Viewer"
  ],
  "affected_vendors": [
    "SAP"
  ],
  "credit": "xina1i at seczone",
  "cve": "CVE-2021-21461",
  "cve_url": "https://www.cve.org/CVERecord?id=CVE-2021-21461",
  "cvss": 7.8,
  "cvss_vector": "AV:L/AC:L/PR:N/UI:R/S:U/C:H/I:H/A:H",
  "disclosure_timeline": [
    "2020-10-21 - Vulnerability reported to vendor",
    "2021-01-12 - Coordinated public release of advisory"
  ],
  "kind": "published",
  "search_text": "published ZDI-21-014 ZDI-CAN-12037 SAP 3D Visual Enterprise Viewer BMP File Parsing Out-Of-Bounds Write Remote Code Execution Vulnerability 2021-01-12 CVE-2021-21461 https://www.cve.org/CVERecord?id=CVE-2021-21461 7.8 AV:L/AC:L/PR:N/UI:R/S:U/C:H/I:H/A:H ['SAP'] ['3D Visual Enterprise Viewer'] This vulnerability allows remote attackers to execute arbitrary code on affected installations of SAP 3D Visual Enterprise Viewer. User interaction is required to exploit this vulnerability in that the target must visit a malicious page or open a malicious file. The specific flaw exists within the parsing of BMP files. The issue results from the lack of proper validation of user-supplied data, which can result in a write past the end of an allocated data structure. An attacker can leverage this vulnerability to execute code in the context of the current process. fixed with the latest patch release VE Viewer 9.0 FP10 ['2020-10-21 - Vulnerability reported to vendor', '2021-01-12 - Coordinated public release of advisory'] xina1i at seczone https://www.zerodayinitiative.com/advisories/ZDI-21-014/",
  "source_url": "https://www.zerodayinitiative.com/advisories/ZDI-21-014/",
  "title": "SAP 3D Visual Enterprise Viewer BMP File Parsing Out-Of-Bounds Write Remote Code Execution Vulnerability",
  "updated_date": null,
  "vulnerability_details": "This vulnerability allows remote attackers to execute arbitrary code on affected installations of SAP 3D Visual Enterprise Viewer. User interaction is required to exploit this vulnerability in that the target must visit a malicious page or open a malicious file. The specific flaw exists within the parsing of BMP files. The issue results from the lack of proper validation of user-supplied data, which can result in a write past the end of an allocated data structure. An attacker can leverage this vulnerability to execute code in the context of the current process.",
  "zdi_can": "ZDI-CAN-12037",
  "zdi_id": "ZDI-21-014"
}
