{
  "additional_details": "Oracle has issued an update to correct this vulnerability. More details can be found at: http://www.oracle.com/technetwork/topics/security/javacpujune2011-313339.html",
  "advisory_date": "2011-06-08",
  "affected_products": [
    "Java Runtime"
  ],
  "affected_vendors": [
    "Oracle"
  ],
  "credit": "Chris Ries",
  "cve": "CVE-2011-0863",
  "cve_url": "https://www.cve.org/CVERecord?id=CVE-2011-0863",
  "cvss": 9.0,
  "cvss_vector": "AV:N/AC:L/Au:N/C:P/I:P/A:C",
  "disclosure_timeline": [
    "2011-01-21 - Vulnerability reported to vendor",
    "2011-06-08 - Coordinated public release of advisory"
  ],
  "kind": "published",
  "search_text": "published ZDI-11-192 ZDI-CAN-1098 Oracle Java Web Start Command Argument Injection Remote Code Execution Vulnerability 2011-06-08 CVE-2011-0863 https://www.cve.org/CVERecord?id=CVE-2011-0863 9.0 AV:N/AC:L/Au:N/C:P/I:P/A:C ['Oracle'] ['Java Runtime'] This vulnerability allows remote attackers to execute arbitrary code on vulnerable installations of Oracle Java. User interaction is required to exploit this vulnerability in that the target must visit a malicious page or open a malicious file. The specific flaw exists within the way Java webstart parses certain properties from the jnlp file. Due to insufficient quote escaping it is possible to supply additional command line parameters to the java process. By crafting such parameters, an attacker can execute remote code under the context of the user running the process. Oracle has issued an update to correct this vulnerability. More details can be found at: http://www.oracle.com/technetwork/topics/security/javacpujune2011-313339.html ['2011-01-21 - Vulnerability reported to vendor', '2011-06-08 - Coordinated public release of advisory'] Chris Ries https://www.zerodayinitiative.com/advisories/ZDI-11-192/",
  "source_url": "https://www.zerodayinitiative.com/advisories/ZDI-11-192/",
  "title": "Oracle Java Web Start Command Argument Injection Remote Code Execution Vulnerability",
  "updated_date": null,
  "vulnerability_details": "This vulnerability allows remote attackers to execute arbitrary code on vulnerable installations of Oracle Java. User interaction is required to exploit this vulnerability in that the target must visit a malicious page or open a malicious file. The specific flaw exists within the way Java webstart parses certain properties from the jnlp file. Due to insufficient quote escaping it is possible to supply additional command line parameters to the java process. By crafting such parameters, an attacker can execute remote code under the context of the user running the process.",
  "zdi_can": "ZDI-CAN-1098",
  "zdi_id": "ZDI-11-192"
}
